{
  "schema_version": "1.0.0",
  "record_type": "EXECUTION_ADMISSION_DECISION_v1",
  "decision_id": "dec-max-biped-ap-diag-001",
  "candidate_id": "max_biped_v1_ap_diag_candidate_001",
  "decision_state": "pending_review",
  "requested_execution": {
    "surface_id": "asset_processor_execution",
    "command_or_tool_path": "scripts/powershell/Invoke-MaxineApRealBinaryDiagnosticExecution.ps1",
    "arguments": [
      "--help"
    ]
  },
  "scope": {
    "allowed_input_paths": [
      "examples/sandbox/ap-binary-preflights/max_biped_v1_real_binary_preflight.json"
    ],
    "allowed_output_paths": [
      "examples/sandbox/ap-real-binary-diagnostic-executions/"
    ],
    "blocked_surfaces_confirmed": [
      "o3de_editor_execution",
      "o3de_cli_execution",
      "blender_or_dcc_execution",
      "spawn_or_publish_execution",
      "cache_read",
      "live_asset_database_read",
      "authoritative_source_uuid_claims",
      "authoritative_asset_id_claims",
      "authoritative_product_id_claims",
      "production_path_write",
      "engine_path_write"
    ]
  },
  "approval": {
    "required_phrase_format": "APPROVE EXECUTION ADMISSION <candidate_id>",
    "approval_received": false,
    "approval_phrase_received": ""
  },
  "references": {
    "decision_review_report_path": "docs/maxine/execution-admission/release-execution-admission-review-framework-v1.md",
    "receipt_contract_reference": "docs/maxine/specs/release-publication-execution-receipt-v1.md",
    "rollback_readiness_reference": "docs/maxine/specs/release-publication-rollback-drill-v1.md",
    "safety_verifier_reference": "tools/audit/verify_sandbox_writer_safety.py"
  },
  "post_execution_validation_commands": [
    "python tools/release-lane/run_pilot_release_chain_validation.py",
    "python tools/release-lane/prove_pilot_release_chain.py",
    "python tools/audit/verify_sandbox_writer_safety.py"
  ],
  "admission_outcome": {
    "execution_admitted": false,
    "admission_scope": "none",
    "notes": "Pending review only. No execution admitted."
  }
}
